오산시,외삼미동 고인돌,경기도 오산시 외삼미동 384,031-8036-7604,2021-03-05,,
광명시,충현서원지,경기도 광명시 소하 2동 1084,02-898-0505,2021-03-05,,
연천군,연천향교,경기도 연천군 연천읍 지혜로117번길 20,031-839-2061,2021-03-05,,
김포시,김포향교,경기도 김포시 북변중로25번길 38,031-984-8891,2021-03-05,,
안산시,잿머리성황당,경기도 안산시 성곡동 산76,031-481-3437,2021-03-05,,
여주시,여주향교,경기도 여주시 향교1길 28,031-887-3563,2021-03-05,,
양평군,노산사지,경기도 양평군 서종면 노문리 산 69-7,031-770-2471,2021-03-05,,
양평군,지평향교,경기도 양평군 지평면 지평로 333,031-770-2474,2021-03-05,,
양주시,양주향교,경기도 양주시 부흥로 1423번길 50,031-840-4148,2021-03-05,,
안성시,양성향교,경기도 안성시 양성면 교동길 33-4,031-678-2502,2021-03-05,,
안성시,바우덕이사당,경기도 안성시 서운면 청룡길 128-29,031-677-1330,2021-03-05,,
안성시,덕봉서원,경기도 안성시 양성면 덕봉서원로 529-8,031-677-1330,2021-03-05,,
안성시,안성향교,경기도 안성시 명륜동 118,031-675-0027,2021-03-05,,
안성시,죽산향교,경기도 안성시 죽산면 죽산향교길 54-45,031-678-2502,2021-03-05,,
용인시,심곡서원,경기도 용인시 수지구 심곡로 16-9,031-324-2147,2021-03-05,,
이천시,이천설봉서원,경기도 이천시 경충대로 2709번길 276,031-632-6564,2021-03-05,,
연천군,숭의전,경기도 연천군 미산면 숭의전로 382-27,031-839-2061,2021-03-05,,
김포시,한재당,경기도 김포시 하성면 가금리 224,031-984-8892,2021-03-05,,
포천시,용연서원,경기도 포천시 신북면 신평로72번길 1-13,031-538-2069,2021-03-05,,
남양주시,홍유릉,경기도 남양주시 홍유릉로 352-1,031-591-7043,2021-03-05,,
남양주시,사릉,경기도 남양주시 진건읍 사릉로 180,031-573-8124,2021-03-05,,
남양주시,광릉,경기도 남양주시 진접읍 광릉수목원로 354,031-527-7105,2021-03-05,,
김포시,장릉,경기도 김포시 장릉로 79,031-984-2897,2021-03-05,,
화성시,융릉·건릉,경기도 화성시 안녕동 187-39,031-222-0142,2021-03-05,,
화성시,용주사,경기도 화성시 용주로 136,031-234-0040,2021-03-05,,
파주시,파주삼릉,경기도 파주시 조리읍 삼릉로 89,031-941-4208,2021-03-05,,
여주시,세종대왕릉[유네스코세계문화유산],경기도 여주시 능서면 영릉로 269-50,031-885-3123,2021-03-05,,
여주시,효종대왕릉,경기도 여주시 능서면 영릉로 26-50,031-885-3123,2021-03-05,,
구리시,동구릉,경기도 구리시 동구릉로 197,031-563-2909,2021-03-05,,
고양시,서오릉,경기도 고양시 덕양구 서오릉로 334-92,02-359-0090,2021-03-05,,
고양시,서삼릉,경기도 고양시 덕양구 서삼릉길 233-126,031-962-6009,2021-03-05,,
안산시,한응인 묘역,경기도 안산시 사사동 산86-6,031-481-3437,2021-03-05,,
안산시,안탄대 선생 묘,경기도 안산시 성곡동 615-1,031-481-3437,2021-03-05,,
수원시,심온선생묘,경기도 수원시 영통구 이의동 산13-10,031-228-2476,2021-03-05,,
용인시,정몽주선생묘,경기도 용인시 처인구 모현읍 능곡로 45 영일정씨제각,031-324-2147,2021-03-05,,
시흥시,강희맹선생묘,경기도 시흥시 하상로 59,031-310-6707,2021-03-05,,
성남시,청주한씨 문정공파 묘역 신도비,경기도 성남시 분당구 율동 산2-1,,2021-03-05,,
성남시,풍산군 이종린 묘역,경기도 성남시 분당구 하산운동 264-5,,2021-03-05,,
성남시,이수 선생 묘,경기도 성남시 분당구 궁내로 52,,2021-03-05,,
성남시,이경석 선생 묘,경기도 성남시 분당구 석운동 50-7,,2021-03-05,,
성남시,천림산봉수지,경기도 성남시 분당구 금토동 산35-5,,2021-03-05,,
성남시,전주이씨 태안군파 묘역,경기도 성남시 분당구 정자동 산33-1,,2021-03-05,,
성남시,한산이씨 묘역,경기도 성남시 분당구 성남대로 550,,2021-03-05,,
구리시,광개토태왕비ㆍ동상,경기도 구리시 장자대로 34 (교문동),031-557-1010,2021-03-05,,
수원시,수원행궁동벽화골목,경기도 수원시 팔달구 화서문로 82-6,031-228-2409,2021-03-05,,
광주시,광주 남한산성,경기도 광주시 남한산성면 산성리 935-9,,2021-03-05,,
광주시,광주 남한산성,경기도 광주시 남한산성면 산성리 935-9,,2021-03-05,,
광주시,광주 남한산성,경기도 광주시 남한산성면 산성리 935-9,,2021-03-05,,
광주시,광주 남한산성,경기도 광주시 남한산성면 산성리 935-9,,2021-03-05,,
광주시,광주 남한산성,경기도 광주시 남한산성면 산성리 935-9,,2021-03-05,,

